{
  "block_number": 18500000,
  "block_timestamp": "2023-10-24T12:00:11Z",
  "protocol": "uniswap_v3",
  "event_type": "swap",
  "pool_address": "0x88e6a0c2ddd26feeb64f039a2c41296fcb3f5640",
  "token0": "0xa0b86991c6218b36c1d19d4a2e9eb0ce3606eb48",
  "token1": "0xc02aaa39b223fe8d0a0e5c4f27ead9083c756cc2",
  "amount0": "-1000000000",
  "amount1": "500000000000000000",
  "tx_hash": "0xabcabcabcabcabcabcabcabcabcabcabcabcabcabcabcabcabcabcabcabcabab",
  "log_index": 42
}
